Paper title,Paper link,Year of publishing,Number of citations,Keywords,Relevant for study,Duplicate,Reviewer,Applicable/Non Applicable,Reason for choosing/ not choosing the research paper
Basic performance measurements of the intel optane DC persistent memory module,https://arxiv.org/abs/1903.05714,2019,627,"""Optane"" ""File+System""",Yes,,,,
Spmfs: A scalable persistent memory file system on optane persistent memory,https://dl.acm.org/doi/abs/10.1145/3472456.3472503,2021,10,"""Optane"" ""File+System""",Yes,,,,
A comprehensive empirical study of file systems on optane persistent memory,https://ieeexplore.ieee.org/abstract/document/9605448/,2021,2,"""Optane"" ""File+System""",Yes,,,,
GPU4FS: A Graphics Processor-Accelerated File System,https://os.itec.kit.edu/downloads/2022_MA_Maucher_GPU4FS.pdf,2022,1,"""Optane"" ""File+System""",Yes,,,,
Thoughts on Merging the File System and Virtual Memory System,https://www.memsys.io/wp-content/uploads/2023/09/31.pdf,,0,"""Optane"" ""File+System""",No,,,,
Exploiting intel optane persistent memory for full text search,https://dl.acm.org/doi/abs/10.1145/3459898.3463906,2021,14,"""Optane"" ""File+System""",Yes,,,,
Unexpected performance of Intel® Optane™ DC persistent memory,https://ieeexplore.ieee.org/abstract/document/9072482/,2020,34,"""Optane"" ""File+System""",Yes,,,,
Early evaluation of intel optane non-volatile memory with hpc i/o workloads,https://arxiv.org/abs/1708.02199,2017,34,"""Optane"" ""File+System""",No,,,,
SplitFS: Reducing software overhead in file systems for persistent memory,https://dl.acm.org/doi/abs/10.1145/3341301.3359631,2019,262,"""Optane"" ""File+System""",Yes,,,,
Scalable indexing and search in high-end computing systems,https://search.proquest.com/openview/7eafaa3272d6b6c7b1251bc31ba45337/1?pq-origsite=gscholar&cbl=18750&diss=y,2023,1,"""Optane"" ""File+System""",Yes,,,,
An empirical evaluation of nvm-aware file systems on intel optane dc persistent memory modules,https://www.mdpi.com/2079-9292/10/16/1977,2021,13,"""Optane"" ""File+System""",Yes,,,,
[C] DISTRIBUTED INDEXING AND SEARCH IN LARGE-SCALE STORAGE SYSTEMS,,2022,0,"""Optane"" ""File+System""",Yes,,,,
Lessons learned from the early performance evaluation of Intel optane DC persistent memory in DBMS,https://dl.acm.org/doi/abs/10.1145/3399666.3399898,2020,46,"""Optane"" ""File+System""",Yes,,,,
System evaluation of the intel optane byte-addressable nvm,https://dl.acm.org/doi/abs/10.1145/3357526.3357568,2019,166,"""Optane"" ""File+System""",Yes,,,,
Thoughts on Merging the File System with the Virtual Memory System: Design decisions and their ramifications in developing the Osprey kernel,https://dl.acm.org/doi/abs/10.1145/3631882.3631895,2023,3,"""Optane"" ""File+System""",Yes,,,,
Filesystem fragmentation on modern storage systems,https://dl.acm.org/doi/abs/10.1145/3611386,2023,6,"""Optane"" ""File+System""",Yes,,,,
Ethane: an asymmetric file system for disaggregated persistent memory,https://www.usenix.org/conference/atc24/presentation/cai,2024,0,"""Optane"" ""File+System""",Yes,,,,
Exploring performance characteristics of the optane 3d xpoint storage technology,https://dl.acm.org/doi/abs/10.1145/3372783,2020,48,"""Optane"" ""File+System""",Yes,,,,
A case study of migrating RocksDB on Intel optane persistent memory,https://ieeexplore.ieee.org/abstract/document/9605438/,2021,3,"""Optane"" ""File+System""",Yes,,,,
Design and implementation of the tianhe-2 data storage and management system,https://link.springer.com/article/10.1007/s11390-020-9799-4,2020,10,"""Optane"" ""File+System""",Yes,,,,
Persistent memory research in the post-optane era,https://dl.acm.org/doi/abs/10.1145/3609308.3625268,2023,22,"""Optane"" ""File+System""",Yes,,,,
Gordon: Benchmarking optane dc persistent memory modules on fpgas,https://ieeexplore.ieee.org/abstract/document/9444052/,2021,12,"""Optane"" ""File+System""",Yes,,,,
Overcoming the Last Mile between Log-Structured File Systems and Persistent Memory via Scatter Logging,https://dl.acm.org/doi/abs/10.1145/3689031.3717488,2025,0,"""Optane"" ""File+System""",Yes,,,,
Writes hurt: Lessons in cache design for optane nvram,https://dl.acm.org/doi/abs/10.1145/3542929.3563461,2022,8,"""Optane"" ""File+System""",Yes,,,,
Scanns: Towards scalable and concurrent data indexing and searching in high-end computing system,https://ieeexplore.ieee.org/abstract/document/9826114/,2022,6,"""Optane"" ""File+System""",Yes,,,,
Ziggurat: A tiered file system for {Non-Volatile} main memories and disks,https://www.usenix.org/conference/fast19/presentation/zheng,2019,141,"""Optane"" ""File+System""",Yes,,,,
An early evaluation of Intel's optane DC persistent memory module and its impact on high-performance scientific applications,https://dl.acm.org/doi/abs/10.1145/3295500.3356159,2019,93,"""Optane"" ""File+System""",Yes,,,,
DeNOVA: Deduplication extended nova file system,https://ieeexplore.ieee.org/abstract/document/9820647/,2022,11,"""Optane"" ""File+System""",Yes,,,,
Revisiting virtual file system for metadata optimized non-volatile main memory file system,https://msstconference.org/MSST-history/2020/Papers/20.RevisitingVFS.pdf,2020,1,"""Optane"" ""File+System""",Yes,,,,
Towards an unwritten contract of intel optane {SSD},https://www.usenix.org/conference/hotstorage19/presentation/wu-kan,2019,92,"""Optane"" ""File+System""",Yes,,,,
Octopus+: An RDMA-Enabled Distributed Persistent Memory File System,https://dl.acm.org/doi/abs/10.1145/3448418,2021,283,"""Optane"" ""File+System""",Yes,,,,
Strata: A cross media file system,https://dl.acm.org/doi/abs/10.1145/3132747.3132770,2017,293,"""Optane"" ""File+System""",No,,,,
A read-efficient and write-optimized hash table for Intel Optane DC Persistent Memory,https://www.sciencedirect.com/science/article/pii/S0167739X24003297,2024,1,"""Optane"" ""File+System""",Yes,,,,
Performance and protection in the ZoFS user-space NVM file system,https://dl.acm.org/doi/abs/10.1145/3341301.3359637,2019,136,"""Optane"" ""File+System""",Yes,,,,
NVM in Data Storage: A Post-Optane Future,https://dl.acm.org/doi/abs/10.1145/3731454,2025,0,"""Optane"" ""File+System""",Yes,,,,
{Side-Channel} Attacks on Optane Persistent Memory,https://www.usenix.org/conference/usenixsecurity23/presentation/liu-sihang,2023,23,"""Optane"" ""File+System""",Yes,,,,
Performance evaluation of the intel optane dc memory with scientific benchmarks,https://ieeexplore.ieee.org/abstract/document/8946136/,2019,20,"""Optane"" ""File+System""",Yes,,,,
Assise: Performance and availability via client-local {NVM} in a distributed file system,https://www.usenix.org/conference/osdi20/presentation/anderson,2020,83,"""Optane"" ""File+System""",Yes,,,,
Understanding and improving persistent transactions on optane™ DC memory,https://ieeexplore.ieee.org/abstract/document/9139799/,2020,14,"""Optane"" ""File+System""",Yes,,,,
Scheduling hpc workflows with intel optane persistent memory,https://ieeexplore.ieee.org/abstract/document/9460699/,2021,7,"""Optane"" ""File+System""",Yes,,,,
Scalable persistent memory file system with {Kernel-Userspace} collaboration,https://www.usenix.org/conference/fast21/presentation/chen-youmin,2021,75,"""Optane"" ""File+System""",Yes,,,,
Full-Scale File System Acceleration on GPU,https://dl.gi.de/items/289ff299-55bb-46cb-8af8-813bdbb1ad55,2024,1,"""Optane"" ""File+System""",Yes,,,,
Energy consumption evaluation of optane dc persistent memory for indexing data structures,https://ieeexplore.ieee.org/abstract/document/10106332/,2022,7,"""Optane"" ""File+System""",Yes,,,,
An empirical study of hybrid ssd with optane and qlc flash,https://ieeexplore.ieee.org/abstract/document/9283520/,2020,7,"""Optane"" ""File+System""",Yes,,,,
WineFS: a hugepage-aware file system for persistent memory that ages gracefully,https://dl.acm.org/doi/abs/10.1145/3477132.3483567,2021,56,"""Optane"" ""File+System""",Yes,,,,
Linefs: Efficient smartnic offload of a distributed file system with pipeline parallelism,https://dl.acm.org/doi/abs/10.1145/3477132.3483565,2021,62,"""Optane"" ""File+System""",Yes,,,,
A NUMA-aware NVM file system design for manycore server applications,https://ieeexplore.ieee.org/abstract/document/9285968/,2020,7,"""Optane"" ""File+System""",Yes,,,,
Enabling Faster NGS Analysis on Optane-based Heterogeneous Memory,http://pasalabs.org/papers/2020/SC20_NGS_poster.pdf,2020,3,"""Optane"" ""File+System""",Yes,,,,
Power-aware Computing with Optane Persistent Memory Modules,https://ieeexplore.ieee.org/abstract/document/10196603/,2023,1,"""Optane"" ""File+System""",Yes,,,,
"Zebra: an efficient, RDMA-enabled distributed persistent memory file system",https://link.springer.com/chapter/10.1007/978-3-031-00123-9_28,2022,2,"""Optane"" ""File+System""",Yes,,,,
{FlatFS}: Flatten Hierarchical File System Namespace on Non-volatile Memories,https://www.usenix.org/conference/atc22/presentation/cai,2022,8,"""Optane"" ""File+System""",Yes,,,,
An Empirical Evaluation and Analysis of Performance of Multiple Optane SSDs,https://ieeexplore.ieee.org/abstract/document/9333865/,2021,4,"""Optane"" ""File+System""",Yes,,,,
Kernel/user-level collaborative persistent memory file system with efficiency and protection,https://arxiv.org/abs/1908.10740,1908,4,"""Optane"" ""File+System""",No,,,,
ITEC-OS Teaching-Bachelor and Master Theses-Finished Theses-GPU4FS: A Graphics Processor-Accelerated File System,https://os.itec.kit.edu/97_3851.php,2022,0,"""Optane"" ""File+System""",Yes,,,,
Is Data Migration Evil in the NVM File System?,https://ieeexplore.ieee.org/abstract/document/9599236/,2021,1,"""Optane"" ""File+System""",Yes,,,,
FINCHFS: Design of Ad-Hoc File System for I/O Heavy HPC Workloads,https://ieeexplore.ieee.org/abstract/document/10740840/,2024,1,"""Optane"" ""File+System""",Yes,,,,
UnifyFS: A user-level shared file system for unified access to distributed local storage,https://ieeexplore.ieee.org/abstract/document/10177390/,2023,24,"""Optane"" ""File+System""",Yes,,,,
System measurement of Intel AEP Optane DIMM,https://arxiv.org/abs/2009.14469,2009,2,"""Optane"" ""File+System""",No,,,,
RomeFS: A CXL-SSD Aware File System Exploiting Synergy of Memory-Block Dual Paths,https://dl.acm.org/doi/abs/10.1145/3698038.3698539,2024,2,"""Optane"" ""File+System""",Yes,,,,
A Survey on File Defragmentation Techniques on Modern Storage Systems,https://ieeexplore.ieee.org/abstract/document/10393099/,2023,0,"""Optane"" ""File+System""",Yes,,,,
RAID on a File System Level for GPU4FS,https://os.itec.kit.edu/downloads/2023_BA_Lucka_RAID_GPU4FS.pdf,2023,0,"""Optane"" ""File+System""",Yes,,,,
Leveraging Intel Optane for HPC Workflows,http://nvmw.ucsd.edu/nvmw2021-program/nvmw2021-data/nvmw2021-paper11-final_version_your_extended_abstract.pdf,,0,"""Optane"" ""File+System""",No,,,,
Evaluating the latest Optane memory: A glorious swansong?,https://www.research.ed.ac.uk/en/publications/evaluating-the-latest-optane-memory-a-glorious-swansong,2023,0,"""Optane"" ""File+System""",Yes,,,,
A performance study of optane persistent memory: from storage data structures' perspective,https://link.springer.com/article/10.1007/s42514-022-00123-x,2022,6,"""Optane"" ""File+System""",Yes,,,,
Intel Optane Data Center Persistent Memory,https://ieeexplore.ieee.org/abstract/document/8875668/,,0,"""Optane"" ""File+System""",No,,,,
Performance characterization of a dram-nvm hybrid memory architecture for hpc applications using intel optane dc persistent memory modules,https://dl.acm.org/doi/abs/10.1145/3357526.3357541,2019,81,"""Optane"" ""File+System""",Yes,,,,
A survey of non-volatile main memory file systems,https://link.springer.com/article/10.1007/s11390-023-1054-3,2023,3,"""Optane"" ""File+System""",Yes,,,,
Directories for GPU4FS,https://os.itec.kit.edu/downloads/2023_BA_Kittner_Dirs_for_GPU4FS.pdf,2023,0,"""Optane"" ""File+System""",Yes,,,,
Chameleondb: a key-value store for optane persistent memory,https://dl.acm.org/doi/abs/10.1145/3447786.3456237,2021,96,"""Optane"" ""File+System""",Yes,,,,
Parallelizing shared file I/O operations of NVM file system for manycore servers,https://ieeexplore.ieee.org/abstract/document/9336709/,2021,6,"""Optane"" ""File+System""",Yes,,,,
{GeminiFS}: A Companion File System for {GPUs},https://www.usenix.org/conference/fast25/presentation/qiu,2025,0,"""Optane"" ""File+System""",Yes,,,,
A performance study of optane persistent memory: From indexing data structures' perspective,https://msstconference.org/MSST-history/2020/Papers/02.APerformanceStudyOptane.pdf,2020,3,"""Optane"" ""File+System""",Yes,,,,
Assise: performance and availability via NVM colocation in a distributed file system,https://arxiv.org/abs/1910.05106,2019,8,"""Optane"" ""File+System""",Yes,,,,
A Study of LS-DYNA® Implicit Running the Rolls-Royce® Large Representative Engine Model with Intel® Optane™ DC Persistent Memory Technology,https://lsdyna.ansys.com/wp-content/uploads/attachments/t8-1-f-computing-technology-188.pdf,,0,"""Optane"" ""File+System""",No,,,,
TPFS: a high-performance tiered file system for persistent memories and disks,https://dl.acm.org/doi/abs/10.1145/3580280,2023,9,"""Optane"" ""File+System""",Yes,,,,
Fast checkpointing of Large Language Models with TensorStore CHFS,https://sc23.supercomputing.org/proceedings/src_poster/poster_files/spostg105s3-file1.pdf,,0,"""Optane"" ""File+System""",No,,,,
File system designs on low-latency storage devices,https://repositories.lib.utexas.edu/items/d6dd0ab1-32ad-44e5-9211-ba53f703c2a1,2020,0,"""Optane"" ""File+System""",Yes,,,,
ReoFS: A Read-Efficient and Write-Optimized File System for Persistent Memory,https://ieeexplore.ieee.org/abstract/document/9376188/,2020,0,"""Optane"" ""File+System""",Yes,,,,
Assise: Performance and Availability via Client-local NVM in a Distributed File System Thomas E. Anderson1 Marco Canini2 Jongyul Kim3 Dejan Kostic4 Youngjin …,https://sands.kaust.edu.sa/papers/assise.osdi20.pdf,,0,"""Optane"" ""File+System""",No,,,,
ctFs: Eliminating File Indexing with Contiguous File System on Persistent Memory,https://search.proquest.com/openview/73a2e2151a3e00fdf1799911ec37ad78/1?pq-origsite=gscholar&cbl=18750&diss=y,2022,0,"""Optane"" ""File+System""",Yes,,,,
Assise: Performance and Availability via Client-local NVM in a Distributed File System,https://wreda.github.io/papers/assise-osdi20.pdf,2020,0,"""Optane"" ""File+System""",Yes,,,,
Single machine graph analytics on massive datasets using intel optane dc persistent memory,https://arxiv.org/abs/1904.07162,2019,104,"""Optane"" ""File+System""",Yes,,,,
Enabling high-performance and secure userspace nvm file systems with the trio architecture,https://dl.acm.org/doi/abs/10.1145/3600006.3613171,2023,16,"""Optane"" ""File+System""",Yes,,,,
Performance Analytics of Graph Algorithms Using Intel Optane DC Persistent Memory,https://search.proquest.com/openview/59840d772290d600c1b8a7f566c93e15/1?pq-origsite=gscholar&cbl=18750&diss=y,2021,0,"""Optane"" ""File+System""",Yes,,,,
{CrossFS}: A cross-layered {Direct-Access} file system,https://www.usenix.org/conference/osdi20/presentation/ren,2020,44,"""Optane"" ""File+System""",Yes,,,,
Exploring efficient architectures on remote in-memory nvm over rdma,https://dl.acm.org/doi/abs/10.1145/3477004,2021,6,"""Optane"" ""File+System""",Yes,,,,
Libnvmmio: Reconstructing software {IO} path with {Failure-Atomic}{Memory-Mapped} interface,https://www.usenix.org/conference/atc20/presentation/choi,2020,40,"""Optane"" ""File+System""",Yes,,,,
On stacking a persistent memory file system on legacy file systems,https://www.usenix.org/conference/fast23/presentation/woo,2023,27,"""Optane"" ""File+System""",Yes,,,,
"Exploiting Flat Namespace to Improve File System Metadata Performance on Ultra-Fast, Byte-Addressable NVMs",https://dl.acm.org/doi/abs/10.1145/3620673,2024,1,"""Optane"" ""File+System""",Yes,,,,
Characterizing the performance of intel optane persistent memory: A close look at its on-dimm buffering,https://dl.acm.org/doi/abs/10.1145/3492321.3519556,2022,65,"""Optane"" ""File+System""",Yes,,,,
Performance evaluation of intel optane memory for managed workloads,https://dl.acm.org/doi/abs/10.1145/3451342,2021,28,"""Optane"" ""File+System""",Yes,,,,
An Empirical Performance Evaluation of Multiple Intel Optane Solid-State Drives,https://www.mdpi.com/2079-9292/10/11/1325,2021,0,"""Optane"" ""File+System""",Yes,,,,
PROFS: CPU Profile-based Tiering File System for All Flash Storage System,http://nvmw.ucsd.edu/nvmw2020-program/unzip/current3/nvmw2020-final8.pdf,,0,"""Optane"" ""File+System""",No,,,,
Simurgh: a fully decentralized and secure NVMM user space file system,https://dl.acm.org/doi/abs/10.1145/3458817.3476180,2021,20,"""Optane"" ""File+System""",Yes,,,,
ctFS: Converting File Index Traversals to Hardware Memory Translation through Contiguous File Allocation for Persistent Memory,https://www.usenix.org/sites/default/files/login_0.pdf,2022,0,"""Optane"" ""File+System""",Yes,,,,
Nova-fortis: A fault-tolerant non-volatile main memory file system,https://dl.acm.org/doi/abs/10.1145/3132747.3132761,2017,215,"""Optane"" ""File+System""",No,,,,
FusionFS: A Contention-Resilient File System for Persistent CPU Caches,https://dl.acm.org/doi/abs/10.1145/3719656,2025,0,"""Optane"" ""File+System""",Yes,,,,
File systems as processes,https://www.usenix.org/conference/hotstorage19/presentation/liu,2019,35,"""Optane"" ""File+System""",Yes,,,,
PetaKV: building efficient key-value store for file system metadata on persistent memory,https://ieeexplore.ieee.org/abstract/document/9999527/,2022,4,"""Optane"" ""File+System""",Yes,,,,
Revisiting persistent indexing structures on Intel Optane DC persistent memory,https://link.springer.com/article/10.1007/s11390-020-9871-0,2021,8,"""Optane"" ""File+System""",Yes,,,,
{SingularFS}: A {Billion-Scale} distributed file system using a single metadata server,https://www.usenix.org/conference/atc23/presentation/guo,2023,12,"""Optane"" ""File+System""",Yes,,,,
Analyzing and Improving CPU and Energy Efficiency of PM File Systems,https://dl.acm.org/doi/abs/10.1145/3609308.3625265,2023,3,"""Optane"" ""File+System""",Yes,,,,
An efficient in-memory analytics system based on persistent memory,https://ieeexplore.ieee.org/abstract/document/10020461/,2022,1,"""Optane"" ""File+System""",Yes,,,,
Accelerating I/O performance of ZFS-based Lustre file system in HPC environment,https://link.springer.com/article/10.1007/s11227-022-04966-7,2023,3,"""Optane"" ""File+System""",Yes,,,,
Numa-aware thread migration for high performance nvmm file systems,https://msstconference.org/MSST-history/2020/Papers/16.NUMAaware.pdf,2020,12,"""Optane"" ""File+System""",Yes,,,,
Performance benefits of Intel® Optane™ DC persistent memory for the parallel processing of large neuroimaging data,https://ieeexplore.ieee.org/abstract/document/9139615/,2020,3,"""Optane"" ""File+System""",Yes,,,,
An Empirical Study of NVM-based File System,https://ieeexplore.ieee.org/abstract/document/9628430/,2021,1,"""Optane"" ""File+System""",Yes,,,,
Performance comparison of daos and lustre for object data storage approaches,https://ieeexplore.ieee.org/abstract/document/10027152/,2022,6,"""Optane"" ""File+System""",Yes,,,,
BPF for storage: an exokernel-inspired approach,https://dl.acm.org/doi/abs/10.1145/3458336.3465290,2021,32,"""Optane"" ""File+System""",Yes,,,,
Libpubl: exploiting persistent user buffers as logs for write atomicity,https://dl.acm.org/doi/abs/10.1145/3465332.3470874,2021,0,"""Optane"" ""File+System""",Yes,,,,
Performance analysis of 3D XPoint SSDs in virtualized and non-virtualized environments,https://ieeexplore.ieee.org/abstract/document/8644859/,2018,19,"""Optane"" ""File+System""",No,,,,
HashTag: Fast Lookup in a Persistent Memory File System,https://ieeexplore.ieee.org/abstract/document/9926368/,2022,0,"""Optane"" ""File+System""",Yes,,,,
Hydra: A decentralized file system for persistent memory and RDMA networks,https://ieeexplore.ieee.org/abstract/document/9792291/,2022,5,"""Optane"" ""File+System""",Yes,,,,
"Don't Maintain Twice, It's Alright: Merged Metadata Management in Deduplication File System with {GogetaFS}",https://www.usenix.org/conference/fast25/presentation/pan,2025,0,"""Optane"" ""File+System""",Yes,,,,
Exploring the Viability of Composable Architectures to Overcome Memory Limitations in High Performance Computing Workflows,https://dl.acm.org/doi/abs/10.1145/3626203.3670620,2024,0,"""Optane"" ""File+System""",Yes,,,,
CHFS: Parallel consistent hashing file system for node-local persistent memory,https://dl.acm.org/doi/abs/10.1145/3492805.3492807,2022,29,"""Optane"" ""File+System""",Yes,,,,
Platform storage performance with 3D XPoint technology,https://ieeexplore.ieee.org/abstract/document/8003284/,2017,302,"""Optane"" ""File+System""",No,,,,
LineFS: Efficient SmartNIC Offload of a Distributed File System with Pipeline Parallelism,http://nvmw.ucsd.edu/nvmw2022-program/nvmw2022-data/nvmw2022-paper32-final_version_your_extended_abstract.pdf,,0,"""Optane"" ""File+System""",No,,,,
{SquirrelFS}: using the Rust compiler to check file-system crash consistency,https://www.usenix.org/conference/osdi24/presentation/leblanc,2024,3,"""Optane"" ""File+System""",Yes,,,,
Siberian supercomputer center as a service for bioinformatics research,https://conf.icgbio.ru/bgrssb2018/wp-content/uploads/sites/35/2017/01/MM-HPC-BBB-2018.pdf#page=17,2018,0,"""Optane"" ""File+System""",No,,,,
Delaying Crash Consistency for Building A High-Performance Persistent Memory File System,https://ieeexplore.ieee.org/abstract/document/10466391/,2024,2,"""Optane"" ""File+System""",Yes,,,,
A High-Performance and Scalable Userspace Log-Structured File System for Modern SSDs,https://dl.acm.org/doi/abs/10.1145/3728645,2025,0,"""Optane"" ""File+System""",Yes,,,,
NapFS: A High-Performance NUMA-Aware PM File System,https://ieeexplore.ieee.org/abstract/document/9978463/,2022,1,"""Optane"" ""File+System""",Yes,,,,
Cheetah: An Adaptive User-Space Cache for Non-volatile Main Memory File Systems,https://link.springer.com/chapter/10.1007/978-3-030-85896-4_17,2021,0,"""Optane"" ""File+System""",Yes,,,,
Beaver: A High-Performance and Crash-Consistent File System Cache via PM-DRAM Collaborative Memory Tiering,https://dl.acm.org/doi/abs/10.1145/3700414,2024,0,"""Optane"" ""File+System""",Yes,,,,
Reducing relational database performance bottlenecks using 3D XPoint storage technology,https://ieeexplore.ieee.org/abstract/document/8456140/,2018,12,"""Optane"" ""File+System""",No,,,,
A Connectivity Reduction Based Optimization Method for Task Level Parallel File System,https://ieeexplore.ieee.org/abstract/document/9972985/,2022,0,"""Optane"" ""File+System""",Yes,,,,
NVMulator: A configurable open-source non-volatile memory emulator for FPGAs,https://link.springer.com/chapter/10.1007/978-3-031-42921-7_3,2023,2,"""Optane"" ""File+System""",Yes,,,,
Cascade lake: Next generation intel xeon scalable processor,https://ieeexplore.ieee.org/abstract/document/8641463/,2019,97,"""Optane"" ""File+System""",Yes,,,,
Persistent memory based and feature rich file system design,https://ieeexplore.ieee.org/abstract/document/8646066/,2018,1,"""Optane"" ""File+System""",No,,,,
Towards Enhanced I/O Performance of NVM File Systems,https://ieeexplore.ieee.org/abstract/document/10487081/,2023,0,"""Optane"" ""File+System""",Yes,,,,
DaxVM: Stressing the limits of memory as a file interface,https://ieeexplore.ieee.org/abstract/document/9923852/,2022,17,"""Optane"" ""File+System""",Yes,,,,
Cfs: Scaling metadata service for distributed file system via pruned scope of critical sections,https://dl.acm.org/doi/abs/10.1145/3552326.3587443,2023,11,"""Optane"" ""File+System""",Yes,,,,
Max: A {Multicore-Accelerated} file system for flash storage,https://www.usenix.org/conference/atc21/presentation/liao,2021,36,"""Optane"" ""File+System""",Yes,,,,
A Two Tier Hybrid Metadata Management Mechanism for NVM Storage System,https://link.springer.com/chapter/10.1007/978-3-030-93571-9_16,2021,0,"""Optane"" ""File+System""",Yes,,,,
Towards low-latency I/O services for mixed workloads using ultra-low latency SSDs,https://dl.acm.org/doi/abs/10.1145/3524059.3532378,2022,12,"""Optane"" ""File+System""",Yes,,,,
{CompoundFS}: Compounding {I/O} Operations in Firmware File Systems,https://www.usenix.org/conference/hotstorage20/presentation/ren,2020,7,"""Optane"" ""File+System""",Yes,,,,
ITEC-OS Studium und Lehre-Bachelor-and Masterarbeiten-Abgeschlossene Arbeiten-GPU4FS: A Graphics Processor-Accelerated File System,https://os.itec.kit.edu/deutsch/97_3851.php,2022,0,"""Optane"" ""File+System""",Yes,,,,
"{EvFS}: User-level,{Event-Driven} File System for {Non-Volatile} Memory",https://www.usenix.org/conference/hotstorage19/presentation/yoshimura,2019,32,"""Optane"" ""File+System""",Yes,,,,
Revitalizing the Forgotten {On-Chip}{DMA} to Expedite Data Movement in {NVM-based} Storage Systems,https://www.usenix.org/conference/fast23/presentation/su,2023,11,"""Optane"" ""File+System""",Yes,,,,
Finchfs: A High-Performance Ad-Hoc File System Balancing Metadata Scalability and Rename Flexibility,https://papers.ssrn.com/sol3/papers.cfm?abstract_id=5165945,,0,"""Optane"" ""File+System""",No,,,,
AUGEFS: A Scalable Userspace Log-Structured File System for Modern SSDs,https://www.msstconference.org/MSST-history/2024/Papers/msst24-7.2.pdf,,0,"""Optane"" ""File+System""",No,,,,
DAOS as HPC Storage: Exploring Interfaces,https://ieeexplore.ieee.org/abstract/document/10321870/,2023,4,"""Optane"" ""File+System""",Yes,,,,
Persistent Memory File Systems: A Survey,https://arxiv.org/abs/2310.02880,2023,0,"""Optane"" ""File+System""",Yes,,,,
NVMFS-IOzone: Performance evaluation for the new NVMM-based file systems,https://dl.acm.org/doi/abs/10.1145/3383669.3398281,2020,2,"""Optane"" ""File+System""",Yes,,,,
pNOVA: Optimizing shared file I/O operations of NVM file system on manycore servers,https://dl.acm.org/doi/abs/10.1145/3343737.3343748,2019,20,"""Optane"" ""File+System""",Yes,,,,
