Predicting file lifetimes for data placement in multi-tiered storage systems for HPC,https://dl.acm.org/doi/abs/10.1145/3439839.3458733,2021,16,"""Optane"" ""High+Performance+Computing""",Yes,,,,
Performance Characterizations and Usage Guidelines of Samsung CXL Memory Module Hybrid Prototype,https://arxiv.org/abs/2503.22017,2025,0,"""Optane"" ""High+Performance+Computing""",Yes,,,,
Characterizations and Architectural Implications of NVM's External DRAM Cache,https://ieeexplore.ieee.org/abstract/document/8855373/,2019,1,"""Optane"" ""High+Performance+Computing""",Yes,,,,
Accelerating General Relativistic Radiation Magnetohydrodynamic Simulations with GPUs,https://dl.acm.org/doi/abs/10.1145/3712031.3712032,2025,0,"""Optane"" ""High+Performance+Computing""",Yes,,,,
Er-kv: High performance hybrid fault-tolerant key-value store,https://ieeexplore.ieee.org/abstract/document/9780898/,2021,2,"""Optane"" ""High+Performance+Computing""",Yes,,,,
The evolving role of storage-class memory in servers and large systems,https://www.sciencedirect.com/science/article/pii/B9780128207581000029,2022,1,"""Optane"" ""High+Performance+Computing""",Yes,,,,
Exploring object stores for high-energy physics data storage,https://www.epj-conferences.org/articles/epjconf/abs/2021/05/epjconf_chep2021_02066/epjconf_chep2021_02066.html,2021,17,"""Optane"" ""High+Performance+Computing""",Yes,,,,
Portus: Efficient dnn checkpointing to persistent memory with zero-copy,https://ieeexplore.ieee.org/abstract/document/10630969/,2024,1,"""Optane"" ""High+Performance+Computing""",Yes,,,,
ACM Gordon Bell Finalists,https://ieeexplore.ieee.org/abstract/document/10902214/,,0,"""Optane"" ""High+Performance+Computing""",No,,,,
The research and analysis of efficiency of hardware usage base on HDFS,https://link.springer.com/article/10.1007/s10586-022-03597-0,2022,10,"""Optane"" ""High+Performance+Computing""",Yes,,,,
Disaggregated cloud memory with elastic block management,https://ieeexplore.ieee.org/abstract/document/8400405/,2018,40,"""Optane"" ""High+Performance+Computing""",No,,,,
High-Speed Storage in AI Systems: Unlocking Real-Time Analytics in Cloud-Integrated Frameworks,https://papers.ssrn.com/sol3/papers.cfm?abstract_id=5094309,2023,10,"""Optane"" ""High+Performance+Computing""",Yes,,,,
Taming Multi-node Accelerated Analytics: An Experience in Porting MATLAB to Scale with Python,https://link.springer.com/chapter/10.1007/978-3-031-08812-4_20,2022,3,"""Optane"" ""High+Performance+Computing""",Yes,,,,
Fast checkpointing of Large Language Models with TensorStore CHFS,https://sc23.supercomputing.org/proceedings/src_poster/poster_files/spostg105s3-file1.pdf,,0,"""Optane"" ""High+Performance+Computing""",No,,,,
MTM: Rethinking memory profiling and migration for multi-tiered large memory,https://dl.acm.org/doi/abs/10.1145/3627703.3650075,2024,18,"""Optane"" ""High+Performance+Computing""",Yes,,,,
Numa-aware thread migration for high performance nvmm file systems,https://msstconference.org/MSST-history/2020/Papers/16.NUMAaware.pdf,2020,12,"""Optane"" ""High+Performance+Computing""",Yes,,,,
HPC-Cloud-Big Data Convergent Architectures and Research Data Management: The LEXIS Approach,https://www.researchgate.net/profile/T-Goubier/publication/355510090_HPC-Cloud-Big_Data_Convergent_Architectures_and_Research_Data_Management_The_LEXIS_Approach/links/63a0838e40358f78eb017028/HPC-Cloud-Big-Data-Convergent-Architectures-and-Research-Data-Management-The-LEXIS-Approach.pdf,,0,"""Optane"" ""High+Performance+Computing""",No,,,,
Full-Scale Simulation of the Super C-Tau Factory Computing Infrastructure to Determine the Characteristics of the Necessary Hardware,https://link.springer.com/chapter/10.1007/978-3-031-22941-1_33,2022,0,"""Optane"" ""High+Performance+Computing""",Yes,,,,
Wrangling rogues: A case study on managing experimental post-moore architectures,https://dl.acm.org/doi/abs/10.1145/3332186.3332223,2019,4,"""Optane"" ""High+Performance+Computing""",Yes,,,,
Simplified Interface to Complex Memory (SICM) FY19 Project Review [Slides],https://www.osti.gov/servlets/purl/1569724,2019,0,"""Optane"" ""High+Performance+Computing""",Yes,,,,
BaM: A case for enabling fine-grain high throughput GPU-orchestrated access to storage,https://www.academia.edu/download/114662378/2203.04910v2.pdf,2022,12,"""Optane"" ""High+Performance+Computing""",Yes,,,,
In Situ Visualization With Temporal Caching,https://ieeexplore.ieee.org/abstract/document/9388894/,2021,8,"""Optane"" ""High+Performance+Computing""",Yes,,,,
HORIZONTALLY SCALABLE DIGITAL FOOTPRINTS STORAGE AND PROCESSING TECHNOLOGIES AS AN INTEGRAL PART OF IT-PROFESSIONAL TRAINING …,https://www.researchgate.net/profile/Mikhail-Belov-5/publication/381248085_How_Digital_Footprints_Shape_IT-Education_and_Drive_Digital_Transformation/links/674d03253d17281c7df30b58/How-Digital-Footprints-Shape-IT-Education-and-Drive-Digital-Transformation.pdf,2023,0,"""Optane"" ""High+Performance+Computing""",Yes,,,,
"Labstor: A modular and extensible platform for developing high-performance, customized i/o stacks in userspace",https://ieeexplore.ieee.org/abstract/document/10046077/,2022,9,"""Optane"" ""High+Performance+Computing""",Yes,,,,
Assessment of the I/O and Storage Subsystem in Modular Supercomputing Architectures,https://ieeexplore.ieee.org/abstract/document/9912665/,2022,3,"""Optane"" ""High+Performance+Computing""",Yes,,,,
Persistent memory hash indexes: An experimental evaluation,https://dl.acm.org/doi/abs/10.14778/3446095.3446101,2021,55,"""Optane"" ""High+Performance+Computing""",Yes,,,,
A High-Performance Collective I/O Framework Leveraging Node-Local Persistent Memory,https://link.springer.com/chapter/10.1007/978-3-031-69766-1_13,2024,0,"""Optane"" ""High+Performance+Computing""",Yes,,,,
Sparse matrix-matrix multiplication on multilevel memory architectures: Algorithms and experiments,https://arxiv.org/abs/1804.00695,2018,10,"""Optane"" ""High+Performance+Computing""",No,,,,
초고성능 컴퓨팅을 위한 반도체 기술 발전 동향,https://www.dbpia.co.kr/Journal/articleDetail?nodeId=NODE11132233,2022,0,"""Optane"" ""High+Performance+Computing""",Yes,,,,
JASS: a tunable checkpointing system for nvm-based systems,https://ieeexplore.ieee.org/abstract/document/10487090/,2023,2,"""Optane"" ""High+Performance+Computing""",Yes,,,,
MOSIQS: Persistent memory object storage with metadata indexing and querying for scientific computing,https://ieeexplore.ieee.org/abstract/document/9448213/,2021,12,"""Optane"" ""High+Performance+Computing""",Yes,,,,
Enforcing Crash Consistency of Scientific Applications in Non-Volatile Main Memory Systems,https://ieeexplore.ieee.org/abstract/document/8945958/,2019,0,"""Optane"" ""High+Performance+Computing""",Yes,,,,
Allocation Policies Matter for Hybrid Memory Systems (Poster and Extended Abstract),https://par.nsf.gov/biblio/10413854,2023,0,"""Optane"" ""High+Performance+Computing""",Yes,,,,
NStore: A High-Performance NUMA-Aware Key-Value Store for Hybrid PM-DRAM Memory,https://ieeexplore.ieee.org/abstract/document/10761975/,2024,0,"""Optane"" ""High+Performance+Computing""",Yes,,,,
Motivating Next-Generation OS Physical Memory Management for Terabyte-Scale NVMMs,https://arxiv.org/abs/2310.03370,2023,0,"""Optane"" ""High+Performance+Computing""",Yes,,,,
Efficient Data Management Schemes for High-Performance Storage Devices,https://s-space.snu.ac.kr/bitstream/10371/143099/1/Efficient%20Data%20Management%20Schemes%20for%20High-Performance%20Storage%20Devices.pdf,2018,0,"""Optane"" ""High+Performance+Computing""",No,,,,
Current status of the MICC: An overview,https://ceur-ws.org/Vol-3041/1-8-paper-1.pdf,2021,11,"""Optane"" ""High+Performance+Computing""",Yes,,,,
"Userland co-pager: boosting data-intensive applications with non-volatile memory, userspace paging",https://dl.acm.org/doi/abs/10.1145/3318265.3318272,2019,8,"""Optane"" ""High+Performance+Computing""",Yes,,,,
"Leveraging NVMe SSDs for building a fast, cost-effective, LSM-tree-based KV store",https://dl.acm.org/doi/abs/10.1145/3480963,2021,19,"""Optane"" ""High+Performance+Computing""",Yes,,,,
ABCI 2.0: Advances in open AI computing infrastructure at AIST,https://ipsj.ixsq.nii.ac.jp/ej/?action=pages_view_main&active_action=repository_view_main_item_detail&item_id=211886&item_no=1&page_id=13&block_id=8,2021,5,"""Optane"" ""High+Performance+Computing""",Yes,,,,
An SIMD-Accelerated Metadata Management Scheme for Persistent Memory File Systems,https://ieeexplore.ieee.org/abstract/document/9826066/,2022,0,"""Optane"" ""High+Performance+Computing""",Yes,,,,
MD-HM: memoization-based molecular dynamics simulations on big memory system,https://dl.acm.org/doi/abs/10.1145/3447818.3460365,2021,26,"""Optane"" ""High+Performance+Computing""",Yes,,,,
An evaluation of daos for simulation and deep learning hpc workloads,https://dl.acm.org/doi/abs/10.1145/3578353.3589542,2023,3,"""Optane"" ""High+Performance+Computing""",Yes,,,,
Reducing CPU power consumption for low-latency SSDs,https://ieeexplore.ieee.org/abstract/document/8537699/,2018,6,"""Optane"" ""High+Performance+Computing""",No,,,,
Understanding and Optimizing Large-scale Plasma Simulations on Persistent Memory-based Systems,http://www.pasalabs.org/papers/2020/IPDPS21_WarpX_Optane.pdf,,0,"""Optane"" ""High+Performance+Computing""",No,,,,
PACTree: A High Performance Persistent Range Index Using PAC Guidelines,https://rs3lab.github.io/assets/papers/2021/kim:pactree.pdf,2021,0,"""Optane"" ""High+Performance+Computing""",Yes,,,,
Flexible and effective object tiering for heterogeneous memory systems,https://dl.acm.org/doi/abs/10.1145/3708540,2025,2,"""Optane"" ""High+Performance+Computing""",Yes,,,,
